{
  "manifest_version": "2.0",
  "identity": {
    "company_name": "Shanghai Biren Technology Co., Ltd. (上海壁仞科技股份有限公司)",
    "as_of_date": "2026-08-04",
    "currency": "RMB",
    "unit": "thousand",
    "fiscal_year_end": "12-31",
    "base_year": 2025,
    "forecast_years": [
      2026,
      2027,
      2028,
      2029,
      2030
    ]
  },
  "scenario_policy": {
    "scenario_set": [
      "low",
      "base",
      "high"
    ],
    "source": "biren_revenue_forecast_2026-08-04",
    "definitions": {
      "low": "Downside: foundry constraints / margin pressure",
      "base": "Central BR20X ramp",
      "high": "Upside: strong adoption / PS premium"
    }
  },
  "required_constraint_ids": [],
  "segments": [
    {
      "name": "Intelligent Computing Solutions",
      "financial_model": {
        "financial_model_schema_version": "2.0",
        "scope": {
          "type": "segment",
          "name": "Intelligent Computing Solutions"
        },
        "model_family": "operating_company",
        "parameters": [
          {
            "parameter_id": "gm_low_2026",
            "kind": "analyst_assumption",
            "value": 0.5,
            "unit": "ratio",
            "period": "FY2026",
            "definition": "gm ratio",
            "dimension": "ratio",
            "time_basis": "annual",
            "scenario": "low",
            "source_ids": [],
            "claim_ids": [],
            "rationale": "Biren E2E fixture: FY2025 gross margin 53.8% / adjusted net margin ~-84.5% (FY2025 AR); margins normalize with scale."
          },
          {
            "parameter_id": "gm_low_2027",
            "kind": "analyst_assumption",
            "value": 0.5,
            "unit": "ratio",
            "period": "FY2027",
            "definition": "gm ratio",
            "dimension": "ratio",
            "time_basis": "annual",
            "scenario": "low",
            "source_ids": [],
            "claim_ids": [],
            "rationale": "Biren E2E fixture: FY2025 gross margin 53.8% / adjusted net margin ~-84.5% (FY2025 AR); margins normalize with scale."
          },
          {
            "parameter_id": "gm_low_2028",
            "kind": "analyst_assumption",
            "value": 0.5,
            "unit": "ratio",
            "period": "FY2028",
            "definition": "gm ratio",
            "dimension": "ratio",
            "time_basis": "annual",
            "scenario": "low",
            "source_ids": [],
            "claim_ids": [],
            "rationale": "Biren E2E fixture: FY2025 gross margin 53.8% / adjusted net margin ~-84.5% (FY2025 AR); margins normalize with scale."
          },
          {
            "parameter_id": "gm_low_2029",
            "kind": "analyst_assumption",
            "value": 0.5,
            "unit": "ratio",
            "period": "FY2029",
            "definition": "gm ratio",
            "dimension": "ratio",
            "time_basis": "annual",
            "scenario": "low",
            "source_ids": [],
            "claim_ids": [],
            "rationale": "Biren E2E fixture: FY2025 gross margin 53.8% / adjusted net margin ~-84.5% (FY2025 AR); margins normalize with scale."
          },
          {
            "parameter_id": "gm_low_2030",
            "kind": "analyst_assumption",
            "value": 0.5,
            "unit": "ratio",
            "period": "FY2030",
            "definition": "gm ratio",
            "dimension": "ratio",
            "time_basis": "annual",
            "scenario": "low",
            "source_ids": [],
            "claim_ids": [],
            "rationale": "Biren E2E fixture: FY2025 gross margin 53.8% / adjusted net margin ~-84.5% (FY2025 AR); margins normalize with scale."
          },
          {
            "parameter_id": "gm_base_2026",
            "kind": "analyst_assumption",
            "value": 0.538,
            "unit": "ratio",
            "period": "FY2026",
            "definition": "gm ratio",
            "dimension": "ratio",
            "time_basis": "annual",
            "scenario": "base",
            "source_ids": [],
            "claim_ids": [],
            "rationale": "Biren E2E fixture: FY2025 gross margin 53.8% / adjusted net margin ~-84.5% (FY2025 AR); margins normalize with scale."
          },
          {
            "parameter_id": "gm_base_2027",
            "kind": "analyst_assumption",
            "value": 0.538,
            "unit": "ratio",
            "period": "FY2027",
            "definition": "gm ratio",
            "dimension": "ratio",
            "time_basis": "annual",
            "scenario": "base",
            "source_ids": [],
            "claim_ids": [],
            "rationale": "Biren E2E fixture: FY2025 gross margin 53.8% / adjusted net margin ~-84.5% (FY2025 AR); margins normalize with scale."
          },
          {
            "parameter_id": "gm_base_2028",
            "kind": "analyst_assumption",
            "value": 0.538,
            "unit": "ratio",
            "period": "FY2028",
            "definition": "gm ratio",
            "dimension": "ratio",
            "time_basis": "annual",
            "scenario": "base",
            "source_ids": [],
            "claim_ids": [],
            "rationale": "Biren E2E fixture: FY2025 gross margin 53.8% / adjusted net margin ~-84.5% (FY2025 AR); margins normalize with scale."
          },
          {
            "parameter_id": "gm_base_2029",
            "kind": "analyst_assumption",
            "value": 0.538,
            "unit": "ratio",
            "period": "FY2029",
            "definition": "gm ratio",
            "dimension": "ratio",
            "time_basis": "annual",
            "scenario": "base",
            "source_ids": [],
            "claim_ids": [],
            "rationale": "Biren E2E fixture: FY2025 gross margin 53.8% / adjusted net margin ~-84.5% (FY2025 AR); margins normalize with scale."
          },
          {
            "parameter_id": "gm_base_2030",
            "kind": "analyst_assumption",
            "value": 0.538,
            "unit": "ratio",
            "period": "FY2030",
            "definition": "gm ratio",
            "dimension": "ratio",
            "time_basis": "annual",
            "scenario": "base",
            "source_ids": [],
            "claim_ids": [],
            "rationale": "Biren E2E fixture: FY2025 gross margin 53.8% / adjusted net margin ~-84.5% (FY2025 AR); margins normalize with scale."
          },
          {
            "parameter_id": "gm_high_2026",
            "kind": "analyst_assumption",
            "value": 0.58,
            "unit": "ratio",
            "period": "FY2026",
            "definition": "gm ratio",
            "dimension": "ratio",
            "time_basis": "annual",
            "scenario": "high",
            "source_ids": [],
            "claim_ids": [],
            "rationale": "Biren E2E fixture: FY2025 gross margin 53.8% / adjusted net margin ~-84.5% (FY2025 AR); margins normalize with scale."
          },
          {
            "parameter_id": "gm_high_2027",
            "kind": "analyst_assumption",
            "value": 0.58,
            "unit": "ratio",
            "period": "FY2027",
            "definition": "gm ratio",
            "dimension": "ratio",
            "time_basis": "annual",
            "scenario": "high",
            "source_ids": [],
            "claim_ids": [],
            "rationale": "Biren E2E fixture: FY2025 gross margin 53.8% / adjusted net margin ~-84.5% (FY2025 AR); margins normalize with scale."
          },
          {
            "parameter_id": "gm_high_2028",
            "kind": "analyst_assumption",
            "value": 0.58,
            "unit": "ratio",
            "period": "FY2028",
            "definition": "gm ratio",
            "dimension": "ratio",
            "time_basis": "annual",
            "scenario": "high",
            "source_ids": [],
            "claim_ids": [],
            "rationale": "Biren E2E fixture: FY2025 gross margin 53.8% / adjusted net margin ~-84.5% (FY2025 AR); margins normalize with scale."
          },
          {
            "parameter_id": "gm_high_2029",
            "kind": "analyst_assumption",
            "value": 0.58,
            "unit": "ratio",
            "period": "FY2029",
            "definition": "gm ratio",
            "dimension": "ratio",
            "time_basis": "annual",
            "scenario": "high",
            "source_ids": [],
            "claim_ids": [],
            "rationale": "Biren E2E fixture: FY2025 gross margin 53.8% / adjusted net margin ~-84.5% (FY2025 AR); margins normalize with scale."
          },
          {
            "parameter_id": "gm_high_2030",
            "kind": "analyst_assumption",
            "value": 0.58,
            "unit": "ratio",
            "period": "FY2030",
            "definition": "gm ratio",
            "dimension": "ratio",
            "time_basis": "annual",
            "scenario": "high",
            "source_ids": [],
            "claim_ids": [],
            "rationale": "Biren E2E fixture: FY2025 gross margin 53.8% / adjusted net margin ~-84.5% (FY2025 AR); margins normalize with scale."
          },
          {
            "parameter_id": "nm_low_2026",
            "kind": "analyst_assumption",
            "value": -0.95,
            "unit": "ratio",
            "period": "FY2026",
            "definition": "nm ratio",
            "dimension": "ratio",
            "time_basis": "annual",
            "scenario": "low",
            "source_ids": [],
            "claim_ids": [],
            "rationale": "Biren E2E fixture: FY2025 gross margin 53.8% / adjusted net margin ~-84.5% (FY2025 AR); margins normalize with scale."
          },
          {
            "parameter_id": "nm_low_2027",
            "kind": "analyst_assumption",
            "value": -0.95,
            "unit": "ratio",
            "period": "FY2027",
            "definition": "nm ratio",
            "dimension": "ratio",